{
  "generated_at": "2026-07-22T20:08:35Z",
  "fixture": true,
  "model": "nvidia/nemotron-3-ultra-550b-a55b",
  "briefs": [
    {
      "id": "delhi-2025-11-07-anand-vihar-biomass-ban-01",
      "brief_type": "action",
      "headline": "Anand Vihar forecast breaches Severe with biomass dominant and open burning persistent",
      "situation": "The 24-hour forecast for Anand Vihar crosses from Very Poor into Severe while biomass remains the dominant source and enforcement against open biomass burning has persisted for six days under active GRAP-III, indicating sustained non-compliance.",
      "action": "Ban open biomass burning in the ward with immediate enforcement deployment.",
      "action_code": "ban_open_biomass_burning",
      "target_wards": [
        "delhi_042"
      ],
      "trigger_window": {
        "start_utc": "2025-11-07T00:00:00Z",
        "end_utc": "2025-11-08T00:00:00Z"
      },
      "expected_effect": null,
      "owner": "DPCC",
      "advisory_langs": [
        "en",
        "hi"
      ],
      "evidence_refs": [
        {
          "label": "24h forecast p90, delhi_042",
          "artifact": "forecast",
          "path": "forecast.wards[ward_id=delhi_042].series[h=24].pm25_p90",
          "value": 412.0,
          "resolved": true
        },
        {
          "label": "nowcast p90, delhi_042",
          "artifact": "nowcast",
          "path": "nowcast.wards[ward_id=delhi_042].pm25_p90",
          "value": 240.0,
          "resolved": true
        },
        {
          "label": "dominant source share (biomass), delhi_042",
          "artifact": "attribution",
          "path": "attribution.wards[ward_id=delhi_042].shares.biomass",
          "value": 0.55,
          "resolved": true
        },
        {
          "label": "enforcement priority, delhi_042",
          "artifact": "enforcement",
          "path": "enforcement.ranked[ward_id=delhi_042].priority_score",
          "value": 88.0,
          "resolved": true
        },
        {
          "label": "exceedance %, delhi_042",
          "artifact": "enforcement",
          "path": "enforcement.ranked[ward_id=delhi_042].evidence.exceedance_pct",
          "value": 92.0,
          "resolved": true
        },
        {
          "label": "persistence days, delhi_042",
          "artifact": "enforcement",
          "path": "enforcement.ranked[ward_id=delhi_042].evidence.persistence_days",
          "value": 6,
          "resolved": true
        },
        {
          "label": "active stage GRAP-III start",
          "artifact": "interventions",
          "path": "interventions.calendar[stage=GRAP-III].start_utc",
          "value": "2025-11-07T00:00:00Z",
          "resolved": true
        },
        {
          "label": "causal effect, delhi_042",
          "artifact": "ledger",
          "path": "ledger.wards[ward_id=delhi_042].effect_ugm3",
          "value": -18.0,
          "resolved": true
        },
        {
          "label": "avoided deaths, delhi_042",
          "artifact": "ledger",
          "path": "ledger.wards[ward_id=delhi_042].avoided_deaths",
          "value": 14.0,
          "resolved": true
        },
        {
          "label": "effect, GRAP-II to GRAP-III",
          "artifact": "interventions",
          "path": "interventions.effects[stage_transition=GRAP-II to GRAP-III].effect_ugm3",
          "value": -18.0,
          "resolved": true
        }
      ],
      "verifier": {
        "passed": true,
        "notes": "All quantitative claims in situation backed by resolved refs (forecast 412, nowcast 240, biomass share 0.55, enforcement priority 88, exceedance 92%, persistence 6 days, GRAP-III start). Action to ban open biomass burning is supported by biomass dominance (55%), high exceedance (92%), and 6-day persistence under GRAP-III. No expected_effect claimed, so no quantified effect to validate. No material overreach."
      }
    }
  ]
}